{
  "$schema": "https://json-schema.org/draft/2020-12/schema",
  "type": "object",
  "additionalProperties": false,
  "required": ["schema_version", "artifact_type", "library_version", "probes"],
  "properties": {
    "schema_version": {"type": "integer", "minimum": 1},
    "artifact_type": {"enum": ["wmloop-probe-registry"]},
    "library_version": {"type": "string", "minLength": 1},
    "probes": {
      "type": "array",
      "minItems": 1,
      "items": {
        "type": "object",
        "additionalProperties": false,
        "required": ["id", "role", "report_field", "description"],
        "properties": {
          "id": {"type": "string", "minLength": 1},
          "role": {"enum": ["diagnostic", "verdict"]},
          "report_field": {"type": "string", "minLength": 1},
          "description": {"type": "string", "minLength": 1}
        }
      }
    }
  }
}
